{
  "packet_id": "interview-btjgr78-zyw-semantics-pkt-0033",
  "source_id": "video:interview-btjgr78-zyw",
  "source_date": "2026-05-07",
  "interactions": [
    {
      "refs": [
        "video:interview-btjgr78-zyw@transcript:v1#seg-0257",
        "video:interview-btjgr78-zyw@transcript:v1#seg-0258",
        "video:interview-btjgr78-zyw@transcript:v1#seg-0259",
        "video:interview-btjgr78-zyw@transcript:v1#seg-0260",
        "video:interview-btjgr78-zyw@transcript:v1#seg-0261",
        "video:interview-btjgr78-zyw@transcript:v1#seg-0262",
        "video:interview-btjgr78-zyw@transcript:v1#seg-0263",
        "video:interview-btjgr78-zyw@transcript:v1#seg-0264"
      ],
      "kind": "exchange",
      "summary": "Ultimately, it's the people who control the fire that are in charge, right? So ultimately, it's these people, the second layer, the game masters, the financial elite, that control everything. And the financial elite, again, are like the World Bank, you said? No, no. The financial elite are these private bankers. Okay. So are the private bankers controlling me? Because you said I was in the media. Do you want to make ...",
      "speaker_attribution": "interview exchange",
      "confidence": "medium"
    }
  ],
  "speaker_notes": [],
  "claims": [
    {
      "claim": "Jiang discusses in this segment packet: Ultimately, it's the people who control the fire that are in charge, right? So ultimately, it's these people, the second layer, the game masters, the financial elite, that control everything. And the financial elite, again, are like the World Bank, you said? No, no",
      "refs": [
        "video:interview-btjgr78-zyw@transcript:v1#seg-0257",
        "video:interview-btjgr78-zyw@transcript:v1#seg-0258",
        "video:interview-btjgr78-zyw@transcript:v1#seg-0259",
        "video:interview-btjgr78-zyw@transcript:v1#seg-0260",
        "video:interview-btjgr78-zyw@transcript:v1#seg-0261"
      ],
      "temporal_scope": "2026-05-07 interview claim",
      "topic_tags": [
        "interview",
        "geopolitics"
      ],
      "claim_type": "diagnosis",
      "confidence": "low"
    }
  ],
  "signature_moments": [
    {
      "refs": [
        "video:interview-btjgr78-zyw@transcript:v1#seg-0257"
      ],
      "moment": "A memorable thread from this segment centers on Jiang's framing of the topic.",
      "source_phrase": "Ultimately, it's the people who control the fire that are in charge, right? So ultimately, it's these people, the second layer, the game mas",
      "why_it_matters": "It captures the conceptual move used in this interview packet.",
      "tone": "causal-chain",
      "confidence": "low"
    }
  ],
  "glossary_terms": [],
  "chronology_notes": [
    {
      "refs": [
        "video:interview-btjgr78-zyw@transcript:v1#seg-0257",
        "video:interview-btjgr78-zyw@transcript:v1#seg-0258",
        "video:interview-btjgr78-zyw@transcript:v1#seg-0259",
        "video:interview-btjgr78-zyw@transcript:v1#seg-0260",
        "video:interview-btjgr78-zyw@transcript:v1#seg-0261",
        "video:interview-btjgr78-zyw@transcript:v1#seg-0262",
        "video:interview-btjgr78-zyw@transcript:v1#seg-0263",
        "video:interview-btjgr78-zyw@transcript:v1#seg-0264"
      ],
      "note": "Interview packet 33 contributes dated material from 2026-05-07.",
      "possible_update_to_prior_position": false,
      "confidence": "low"
    }
  ],
  "uncertainty_notes": []
}
