{"packet_id":"interview-oerknj-uypa-semantics-pkt-0006","source_id":"video:interview-oerknj-uypa","source_date":"2026-04-01","interactions":[{"refs":["video:interview-oerknj-uypa@transcript:v1#seg-0041","video:interview-oerknj-uypa@transcript:v1#seg-0042","video:interview-oerknj-uypa@transcript:v1#seg-0043","video:interview-oerknj-uypa@transcript:v1#seg-0044"],"kind":"exchange","summary":"Jiang asks whether Jay has been to Israel, Jay distinguishes his teenage Jewish trip from Birthright, and Jiang explains that a 2012 Technion visit gave him a moving, propaganda-powerful Israel tour including Masada and the Holocaust Museum.","speaker_attribution":"Jiang asks and answers; Jay responds.","confidence":"high"},{"refs":["video:interview-oerknj-uypa@transcript:v1#seg-0045","video:interview-oerknj-uypa@transcript:v1#seg-0046","video:interview-oerknj-uypa@transcript:v1#seg-0047","video:interview-oerknj-uypa@transcript:v1#seg-0048"],"kind":"answer","summary":"Jiang explains the dissonance behind his Holocaust comments: after reading Arendt and absorbing the Holocaust Museum narrative, he expected bureaucratic extermination documentation, searched for speeches and direct evidence online, could not find what satisfied him, and therefore made the controversial lecture statement; Jay answers that this will still leave people unsatisfied because mythology outruns truth.","speaker_attribution":"Jiang; then Jay.","confidence":"high"}],"speaker_notes":[{"refs":["video:interview-oerknj-uypa@transcript:v1#seg-0041","video:interview-oerknj-uypa@transcript:v1#seg-0048"],"note":"SPEAKER_00 is Jiang; SPEAKER_01 is Jay. seg-0048 begins Jay's response and continues into the next packet's deeper Holocaust-language discussion.","suggested_speaker":"Jiang / Jay Shapiro","confidence":"high"}],"claims":[{"claim":"Jiang says his 2012 Technion-linked Israel visit was emotionally powerful and that Israeli tour guides and institutions have a strong capacity for propaganda and narrative.","refs":["video:interview-oerknj-uypa@transcript:v1#seg-0043","video:interview-oerknj-uypa@transcript:v1#seg-0044"],"temporal_scope":"Biographical source of later Israel interpretation, stated 2026-04-01.","topic_tags":["israel","propaganda","birthright","masada"],"claim_type":"evidence","confidence":"high"},{"claim":"Jiang says his confusion over Holocaust evidence came from expecting documents matching a systematic bureaucratic extermination mission and not finding direct evidence online that satisfied that expectation.","refs":["video:interview-oerknj-uypa@transcript:v1#seg-0045","video:interview-oerknj-uypa@transcript:v1#seg-0046","video:interview-oerknj-uypa@transcript:v1#seg-0047"],"temporal_scope":"Explanation of prior lecture controversy given 2026-04-01.","topic_tags":["holocaust","evidence","internet-research"],"claim_type":"evidence","confidence":"medium"},{"claim":"Jay maintains that even Jiang's explanation will not satisfy critics because mythologized history can cause people to question whether the underlying truth is true at all.","refs":["video:interview-oerknj-uypa@transcript:v1#seg-0048"],"temporal_scope":"Jay's response on 2026-04-01.","topic_tags":["myth","truth","public-risk"],"claim_type":"diagnosis","confidence":"high"}],"signature_moments":[{"refs":["video:interview-oerknj-uypa@transcript:v1#seg-0044"],"moment":"Jiang says the Israeli tour guide brought them to tears, then later calls that same power propaganda; the emotional success of the story becomes evidence of its political force.","source_phrase":"one of the most moving experiences of my life","why_it_matters":"It shows why he takes myth seriously: not because it is merely false, but because it can move bodies and loyalties.","tone":"reversal","confidence":"high"},{"refs":["video:interview-oerknj-uypa@transcript:v1#seg-0046"],"moment":"Jiang's controversy begins as a mismatch between an expected bureaucratic paper trail and a web search that fails to satisfy him.","source_phrase":"I couldn't find anything","why_it_matters":"It clarifies the epistemic error Jay is probing: internet absence becomes too much weight inside a charged historical question.","tone":"method","confidence":"medium"}],"glossary_terms":[{"term":"propaganda and narrative","refs":["video:interview-oerknj-uypa@transcript:v1#seg-0044"],"definition_or_usage":"Jiang's term for Israel's capacity to convert sites like Masada and the Holocaust Museum into emotionally powerful historical story.","confidence":"high"},{"term":"direct evidence","refs":["video:interview-oerknj-uypa@transcript:v1#seg-0047"],"definition_or_usage":"Jiang's contested standard for Holocaust evidence in the lecture controversy; the packet treats it as his stated criterion, not as a validated historical judgment.","confidence":"medium"}],"chronology_notes":[{"refs":["video:interview-oerknj-uypa@transcript:v1#seg-0043"],"note":"Jiang dates his Israel trip to 2012, when Technion invited him as a well-known educator in China.","possible_update_to_prior_position":false,"confidence":"high"}],"uncertainty_notes":[{"refs":["video:interview-oerknj-uypa@transcript:v1#seg-0045","video:interview-oerknj-uypa@transcript:v1#seg-0047"],"note":"This packet preserves Jiang's explanation of his own search and confusion; it should not be promoted as a factual evaluation of Holocaust documentation."}]}
