{
  "packet_id": "interview-vucfnjlcyqk-semantics-pkt-0008",
  "source_id": "video:interview-vucfnjlcyqk",
  "source_date": "2026-04-06",
  "interactions": [
    {
      "refs": [
        "video:interview-vucfnjlcyqk@transcript:v1#seg-0057",
        "video:interview-vucfnjlcyqk@transcript:v1#seg-0058",
        "video:interview-vucfnjlcyqk@transcript:v1#seg-0059",
        "video:interview-vucfnjlcyqk@transcript:v1#seg-0060",
        "video:interview-vucfnjlcyqk@transcript:v1#seg-0061",
        "video:interview-vucfnjlcyqk@transcript:v1#seg-0062",
        "video:interview-vucfnjlcyqk@transcript:v1#seg-0063",
        "video:interview-vucfnjlcyqk@transcript:v1#seg-0064"
      ],
      "kind": "exchange",
      "summary": "Jiang says social descent may be part of the playbook because a pointless, unwinnable war can produce apathy, discontent, and civil war; Sneako connects this to AI accounts, demoralization, and groups turning against themselves.",
      "speaker_attribution": "Sneako asks or frames the issue; Jiang answers in the main analytic voice where present.",
      "confidence": "high"
    }
  ],
  "speaker_notes": [
    {
      "refs": [
        "video:interview-vucfnjlcyqk@transcript:v1#seg-0057",
        "video:interview-vucfnjlcyqk@transcript:v1#seg-0058",
        "video:interview-vucfnjlcyqk@transcript:v1#seg-0059",
        "video:interview-vucfnjlcyqk@transcript:v1#seg-0060",
        "video:interview-vucfnjlcyqk@transcript:v1#seg-0061",
        "video:interview-vucfnjlcyqk@transcript:v1#seg-0062",
        "video:interview-vucfnjlcyqk@transcript:v1#seg-0063",
        "video:interview-vucfnjlcyqk@transcript:v1#seg-0064"
      ],
      "note": "Machine diarization is consistent in this packet: SPEAKER_00 is Sneako/interviewer and SPEAKER_01 is Jiang, except where intro/outro material is host-only.",
      "suggested_speaker": "Sneako and Jiang",
      "confidence": "high"
    }
  ],
  "claims": [
    {
      "claim": "Jiang says if the Iran war is eschatological and serves a great-reset logic, then civil war in America and Europe becomes part of the script.",
      "refs": [
        "video:interview-vucfnjlcyqk@transcript:v1#seg-0057",
        "video:interview-vucfnjlcyqk@transcript:v1#seg-0058"
      ],
      "temporal_scope": "Claim stated in the 2026-04-06 interview.",
      "topic_tags": [
        "civil-war",
        "great-reset",
        "iran-war",
        "eschatology"
      ],
      "claim_type": "model",
      "confidence": "high"
    },
    {
      "claim": "He and Sneako frame social media conflict as a demoralization strategy that makes potential allies attack each other inside their own circles.",
      "refs": [
        "video:interview-vucfnjlcyqk@transcript:v1#seg-0059",
        "video:interview-vucfnjlcyqk@transcript:v1#seg-0060",
        "video:interview-vucfnjlcyqk@transcript:v1#seg-0061",
        "video:interview-vucfnjlcyqk@transcript:v1#seg-0062",
        "video:interview-vucfnjlcyqk@transcript:v1#seg-0063",
        "video:interview-vucfnjlcyqk@transcript:v1#seg-0064"
      ],
      "temporal_scope": "Claim stated in the 2026-04-06 interview.",
      "topic_tags": [
        "social-media",
        "demoralization",
        "anti-war-coalition"
      ],
      "claim_type": "diagnosis",
      "confidence": "high"
    }
  ],
  "signature_moments": [
    {
      "refs": [
        "video:interview-vucfnjlcyqk@transcript:v1#seg-0057",
        "video:interview-vucfnjlcyqk@transcript:v1#seg-0058"
      ],
      "moment": "Pointlessness itself becomes the weapon: show people the war is unwinnable and make them fight each other.",
      "source_phrase": "civil war is part of the script",
      "why_it_matters": "It turns despair into a political technology.",
      "tone": "reversal",
      "confidence": "high"
    }
  ],
  "glossary_terms": [],
  "chronology_notes": [],
  "uncertainty_notes": []
}
