{
  "packet_id": "predictive-history-04ngqzyqgpw-semantics-pkt-0008",
  "source_id": "video:predictive-history-04ngqzyqgpw",
  "source_date": "2026-06-17",
  "interactions": [
    {
      "refs": [
        "video:predictive-history-04ngqzyqgpw@transcript:v1#seg-0057",
        "video:predictive-history-04ngqzyqgpw@transcript:v1#seg-0058",
        "video:predictive-history-04ngqzyqgpw@transcript:v1#seg-0059",
        "video:predictive-history-04ngqzyqgpw@transcript:v1#seg-0060"
      ],
      "kind": "monologue",
      "summary": "Jiang closes the meta-argument about mission, announces a jump to Cantos 11 and 12, and frames Thomas Aquinas, the Dominicans, Bonaventure, and the Franciscans as reforming forces whose eventual failure Dante wants to explain.",
      "speaker_attribution": "Jiang lecture setup",
      "confidence": "high"
    },
    {
      "refs": [
        "video:predictive-history-04ngqzyqgpw@transcript:v1#seg-0061"
      ],
      "kind": "reading-quoted-material",
      "summary": "Carol reads the opening of Paradise Canto 11, where Dante condemns mortals whose studies and ambitions keep their thought fixed on earthly things.",
      "speaker_attribution": "Carol reading Dante aloud",
      "confidence": "high"
    },
    {
      "refs": [
        "video:predictive-history-04ngqzyqgpw@transcript:v1#seg-0062",
        "video:predictive-history-04ngqzyqgpw@transcript:v1#seg-0063",
        "video:predictive-history-04ngqzyqgpw@transcript:v1#seg-0064"
      ],
      "kind": "exchange",
      "summary": "Jiang asks what Dante's criticism of academic studies means, a student answers that scholars are driven by ulterior motives, and Jiang confirms the response.",
      "speaker_attribution": "Jiang question with student answer",
      "confidence": "high"
    }
  ],
  "speaker_notes": [
    {
      "refs": [
        "video:predictive-history-04ngqzyqgpw@transcript:v1#seg-0061"
      ],
      "note": "The reader is again likely Carol, continuing the reading role Jiang assigns her in this session.",
      "suggested_speaker": "Carol",
      "confidence": "high"
    }
  ],
  "claims": [
    {
      "claim": "Jiang says the platform will skip around Dante not because the omitted cantos are unimportant but because he does not yet feel able to interpret every canto fully and wants to focus on the pieces he can teach honestly.",
      "refs": [
        "video:predictive-history-04ngqzyqgpw@transcript:v1#seg-0057",
        "video:predictive-history-04ngqzyqgpw@transcript:v1#seg-0058"
      ],
      "temporal_scope": "Teaching-method clarification made on 2026-06-17.",
      "topic_tags": [
        "teaching method",
        "interpretive limits",
        "Dante"
      ],
      "claim_type": "other",
      "confidence": "high"
    },
    {
      "claim": "He presents Thomas Aquinas as the second most famous Catholic theologian after Augustine and as the first European figure to reconcile classical Greek philosophy with Christian faith, though similar synthesis was already happening in the Islamic Golden Age.",
      "refs": [
        "video:predictive-history-04ngqzyqgpw@transcript:v1#seg-0058"
      ],
      "temporal_scope": "Historical framing stated on 2026-06-17.",
      "topic_tags": [
        "Thomas Aquinas",
        "Augustine",
        "Greek philosophy",
        "Christianity",
        "Islamic Golden Age"
      ],
      "claim_type": "model",
      "confidence": "medium"
    },
    {
      "claim": "Jiang characterizes the Dominicans as a pre-Jesuit order devoted to learning and education in service of enforcing Christian orthodoxy.",
      "refs": [
        "video:predictive-history-04ngqzyqgpw@transcript:v1#seg-0059"
      ],
      "temporal_scope": "Institutional characterization given on 2026-06-17.",
      "topic_tags": [
        "Dominicans",
        "education",
        "orthodoxy"
      ],
      "claim_type": "definition",
      "confidence": "medium"
    },
    {
      "claim": "He presents the Franciscans as a poverty movement founded by Francis of Assisi in continuity with Jesus and the poor, and he says both the Dominican and Franciscan reforms initially seemed to restore hope to a corrupt Church before later failing.",
      "refs": [
        "video:predictive-history-04ngqzyqgpw@transcript:v1#seg-0059",
        "video:predictive-history-04ngqzyqgpw@transcript:v1#seg-0060"
      ],
      "temporal_scope": "Historical and interpretive framing stated on 2026-06-17.",
      "topic_tags": [
        "Franciscans",
        "poverty",
        "reform",
        "Catholic Church",
        "hope"
      ],
      "claim_type": "model",
      "confidence": "high"
    },
    {
      "claim": "Jiang identifies Dante's governing question here as why reform movements rooted in selfless knowledge or selfless spirituality begin well and still fail.",
      "refs": [
        "video:predictive-history-04ngqzyqgpw@transcript:v1#seg-0060"
      ],
      "temporal_scope": "Interpretive question posed on 2026-06-17.",
      "topic_tags": [
        "reform failure",
        "Dominicans",
        "Franciscans",
        "Dante"
      ],
      "claim_type": "model",
      "confidence": "high"
    },
    {
      "claim": "Jiang interprets Dante's attack on academic studies as a complaint that scholars use thought for earthly ambition rather than for God and truth.",
      "refs": [
        "video:predictive-history-04ngqzyqgpw@transcript:v1#seg-0062",
        "video:predictive-history-04ngqzyqgpw@transcript:v1#seg-0063"
      ],
      "temporal_scope": "Textual interpretation stated on 2026-06-17.",
      "topic_tags": [
        "academia",
        "earthly ambition",
        "God",
        "truth"
      ],
      "claim_type": "diagnosis",
      "confidence": "high"
    }
  ],
  "signature_moments": [
    {
      "refs": [
        "video:predictive-history-04ngqzyqgpw@transcript:v1#seg-0060"
      ],
      "moment": "The whole canto is framed as an autopsy of reform movements that looked like Europe's hope and still failed.",
      "source_phrase": "why is it that these two movements, which started out great ... why did they fail?",
      "why_it_matters": "It names the structural problem Jiang wants Dante to solve: how selfless institutions decay.",
      "tone": "question",
      "confidence": "high"
    },
    {
      "refs": [
        "video:predictive-history-04ngqzyqgpw@transcript:v1#seg-0061"
      ],
      "moment": "Dante's opening image compresses worldly professions and appetites into wings trapped low to the earth.",
      "source_phrase": "syllogistic reasonings that bring your wings to flight so low to earthly things",
      "why_it_matters": "This is the packet's strongest quoted image and sets up Jiang's anti-earthbound reading of scholarship.",
      "tone": "image",
      "confidence": "high"
    },
    {
      "refs": [
        "video:predictive-history-04ngqzyqgpw@transcript:v1#seg-0062"
      ],
      "moment": "Academic study is redefined as suspect when it becomes an earthly career game rather than a path toward God and truth.",
      "source_phrase": "Dante is criticizing academic studies",
      "why_it_matters": "It links the class's mission language to Dante's own attack on misdirected intellectual life.",
      "tone": "definition",
      "confidence": "high"
    }
  ],
  "glossary_terms": [
    {
      "term": "Dominicans",
      "refs": [
        "video:predictive-history-04ngqzyqgpw@transcript:v1#seg-0058",
        "video:predictive-history-04ngqzyqgpw@transcript:v1#seg-0059"
      ],
      "definition_or_usage": "The order Jiang describes as a learning-centered, orthodoxy-enforcing precursor to the Jesuits and one half of Dante's paired reform problem.",
      "confidence": "medium"
    },
    {
      "term": "Franciscan Order",
      "refs": [
        "video:predictive-history-04ngqzyqgpw@transcript:v1#seg-0059",
        "video:predictive-history-04ngqzyqgpw@transcript:v1#seg-0060"
      ],
      "definition_or_usage": "The poverty-centered order founded by Francis of Assisi that Jiang treats as the spiritual counterpart to the Dominicans in Dante's reform drama.",
      "confidence": "high"
    },
    {
      "term": "syllogistic reasonings",
      "refs": [
        "video:predictive-history-04ngqzyqgpw@transcript:v1#seg-0061",
        "video:predictive-history-04ngqzyqgpw@transcript:v1#seg-0062"
      ],
      "definition_or_usage": "In Jiang's reading, the line names intellectual activity that has become earthbound and self-serving rather than oriented toward truth and God.",
      "confidence": "high"
    }
  ],
  "chronology_notes": [
    {
      "refs": [
        "video:predictive-history-04ngqzyqgpw@transcript:v1#seg-0057",
        "video:predictive-history-04ngqzyqgpw@transcript:v1#seg-0062"
      ],
      "note": "This packet marks the seminar's transition on 2026-06-17 from meta-debate about the platform's mission into close reading of Paradise 11 and 12.",
      "possible_update_to_prior_position": false,
      "confidence": "high"
    }
  ],
  "uncertainty_notes": [
    {
      "refs": [
        "video:predictive-history-04ngqzyqgpw@transcript:v1#seg-0058"
      ],
      "note": "Jiang's compressed historical claims about Aquinas, Europe, and the Islamic Golden Age are part of his lecture framing here and should not be treated as settled historiography without separate checking."
    }
  ]
}
