{
  "packet_id": "predictive-history-tymnsa83nhy-semantics-pkt-0008",
  "source_id": "video:predictive-history-tymnsa83nhy",
  "source_date": "2025-03-06",
  "interactions": [
    {
      "refs": [
        "video:predictive-history-tymnsa83nhy@transcript:v1#seg-0057",
        "video:predictive-history-tymnsa83nhy@transcript:v1#seg-0058",
        "video:predictive-history-tymnsa83nhy@transcript:v1#seg-0059",
        "video:predictive-history-tymnsa83nhy@transcript:v1#seg-0060"
      ],
      "kind": "monologue",
      "summary": "Jiang closes with an oral story he tells his son Maomao: a wish for endless strawberries escalates into world crisis, and the promised solution becomes a new wish for endless chocolate.",
      "speaker_attribution": "Jiang lecture/storytelling",
      "confidence": "high"
    },
    {
      "refs": [
        "video:predictive-history-tymnsa83nhy@transcript:v1#seg-0060",
        "video:predictive-history-tymnsa83nhy@transcript:v1#seg-0061",
        "video:predictive-history-tymnsa83nhy@transcript:v1#seg-0062"
      ],
      "kind": "monologue",
      "summary": "He contrasts the wild oral version with the compact written version, arguing that writing changes the story because the words leave the intimate setting and become subject to public judgment.",
      "speaker_attribution": "Jiang lecture",
      "confidence": "high"
    },
    {
      "refs": [
        "video:predictive-history-tymnsa83nhy@transcript:v1#seg-0062",
        "video:predictive-history-tymnsa83nhy@transcript:v1#seg-0063",
        "video:predictive-history-tymnsa83nhy@transcript:v1#seg-0064"
      ],
      "kind": "monologue",
      "summary": "He ends by comparing literacy to Adam and Eve's shame, defining imagination as memory extended by memorable stories, and asking whether civilization has made humans less creative.",
      "speaker_attribution": "Jiang lecture",
      "confidence": "high"
    }
  ],
  "speaker_notes": [
    {
      "refs": [
        "video:predictive-history-tymnsa83nhy@transcript:v1#seg-0064"
      ],
      "note": "Jiang asks 'Any questions?' near the close, but no student question is captured before he announces the next class.",
      "suggested_speaker": "Jiang",
      "confidence": "high"
    }
  ],
  "claims": [
    {
      "claim": "The Maomao strawberry story demonstrates oral tradition's power because a child can remember, alter, and retell it, turning one story into a new story.",
      "refs": [
        "video:predictive-history-tymnsa83nhy@transcript:v1#seg-0057",
        "video:predictive-history-tymnsa83nhy@transcript:v1#seg-0058",
        "video:predictive-history-tymnsa83nhy@transcript:v1#seg-0059",
        "video:predictive-history-tymnsa83nhy@transcript:v1#seg-0060"
      ],
      "temporal_scope": "Jiang's closing example in this lecture",
      "topic_tags": [
        "storytelling",
        "oral-tradition",
        "maomao"
      ],
      "claim_type": "evidence",
      "confidence": "high"
    },
    {
      "claim": "Writing forces Jiang to shorten, moralize, and sanitize the same story because written words leave the intimate relationship and expose the author to outside judgment.",
      "refs": [
        "video:predictive-history-tymnsa83nhy@transcript:v1#seg-0060",
        "video:predictive-history-tymnsa83nhy@transcript:v1#seg-0061",
        "video:predictive-history-tymnsa83nhy@transcript:v1#seg-0062"
      ],
      "temporal_scope": "Media contrast in this lecture",
      "topic_tags": [
        "literary-culture",
        "shame",
        "judgment"
      ],
      "claim_type": "diagnosis",
      "confidence": "high"
    },
    {
      "claim": "In oral culture, intimacy allows play, experiment, curiosity, and adventure; in literary culture, the imagined watcher produces shame and self-consciousness.",
      "refs": [
        "video:predictive-history-tymnsa83nhy@transcript:v1#seg-0062"
      ],
      "temporal_scope": "Core oral/literary contrast in this lecture",
      "topic_tags": [
        "oral-culture",
        "literary-culture",
        "imagination"
      ],
      "claim_type": "model",
      "confidence": "high"
    },
    {
      "claim": "Jiang compares the transition from oral tradition to literary culture to Adam and Eve eating from the tree of knowledge: knowledge brings shame, nakedness, and exile from a prior garden.",
      "refs": [
        "video:predictive-history-tymnsa83nhy@transcript:v1#seg-0062",
        "video:predictive-history-tymnsa83nhy@transcript:v1#seg-0063"
      ],
      "temporal_scope": "Metaphor in this lecture",
      "topic_tags": [
        "adam-and-eve",
        "literacy",
        "shame"
      ],
      "claim_type": "model",
      "confidence": "high"
    },
    {
      "claim": "Imagination is an extension of memory: memorable stories excite imagination and allow creation.",
      "refs": [
        "video:predictive-history-tymnsa83nhy@transcript:v1#seg-0063"
      ],
      "temporal_scope": "Definition in this lecture",
      "topic_tags": [
        "imagination",
        "memory",
        "creation"
      ],
      "claim_type": "definition",
      "confidence": "high"
    },
    {
      "claim": "Jiang asks whether civilization makes humans less creative by making them more ashamed of exploration, curiosity, and play.",
      "refs": [
        "video:predictive-history-tymnsa83nhy@transcript:v1#seg-0064"
      ],
      "temporal_scope": "Closing question in 2025-03-06 lecture",
      "topic_tags": [
        "civilization",
        "creativity",
        "shame"
      ],
      "claim_type": "diagnosis",
      "confidence": "high"
    }
  ],
  "signature_moments": [
    {
      "refs": [
        "video:predictive-history-tymnsa83nhy@transcript:v1#seg-0058",
        "video:predictive-history-tymnsa83nhy@transcript:v1#seg-0059",
        "video:predictive-history-tymnsa83nhy@transcript:v1#seg-0060"
      ],
      "moment": "The strawberry wish floods Beijing, China, Asia, Earth, and the moon, and Maomao solves it by wishing for chocolate.",
      "source_phrase": "I wish for a room full of chocolate every day",
      "why_it_matters": "It shows oral storytelling as excessive, intimate, funny, and generative rather than cleanly moral.",
      "tone": "image",
      "confidence": "high"
    },
    {
      "refs": [
        "video:predictive-history-tymnsa83nhy@transcript:v1#seg-0061"
      ],
      "moment": "The written version becomes compact, safe, and moral: Maomao learns the power of words instead of wrecking the world again.",
      "source_phrase": "Maomao understood the power of words",
      "why_it_matters": "It makes Jiang's media theory visible in the same story told two ways.",
      "tone": "reversal",
      "confidence": "high"
    },
    {
      "refs": [
        "video:predictive-history-tymnsa83nhy@transcript:v1#seg-0062"
      ],
      "moment": "Literacy becomes the eye of the future watching you; the writer feels shame because people a hundred years from now are still looking.",
      "source_phrase": "Hundred years from now people are still watching you",
      "why_it_matters": "It is the strongest statement of Jiang's shame theory of literary culture.",
      "tone": "metaphor",
      "confidence": "high"
    },
    {
      "refs": [
        "video:predictive-history-tymnsa83nhy@transcript:v1#seg-0063",
        "video:predictive-history-tymnsa83nhy@transcript:v1#seg-0064"
      ],
      "moment": "The lecture ends by asking whether civilization itself has made us less creative.",
      "source_phrase": "does civilization make us less creative?",
      "why_it_matters": "It turns the Viking lecture into a broad indictment of progress as possible imaginative loss.",
      "tone": "question",
      "confidence": "high"
    }
  ],
  "glossary_terms": [
    {
      "term": "shame of literacy",
      "refs": [
        "video:predictive-history-tymnsa83nhy@transcript:v1#seg-0061",
        "video:predictive-history-tymnsa83nhy@transcript:v1#seg-0062"
      ],
      "definition_or_usage": "Jiang's idea that writing creates self-consciousness because words leave the intimate scene and become exposed to future public judgment.",
      "confidence": "high"
    },
    {
      "term": "imagination as memory extension",
      "refs": [
        "video:predictive-history-tymnsa83nhy@transcript:v1#seg-0063"
      ],
      "definition_or_usage": "The claim that imagination grows from memorable stories that excite memory into creation.",
      "confidence": "high"
    },
    {
      "term": "Adam and Eve metaphor",
      "refs": [
        "video:predictive-history-tymnsa83nhy@transcript:v1#seg-0062",
        "video:predictive-history-tymnsa83nhy@transcript:v1#seg-0063"
      ],
      "definition_or_usage": "Jiang's metaphor for the shift from oral to literary culture: knowledge produces shame and expulsion from a prior intimacy.",
      "confidence": "high"
    }
  ],
  "chronology_notes": [
    {
      "refs": [
        "video:predictive-history-tymnsa83nhy@transcript:v1#seg-0063",
        "video:predictive-history-tymnsa83nhy@transcript:v1#seg-0064"
      ],
      "note": "Dated 2025-03-06: Jiang closes with a general position that civilization may reduce creativity by increasing shame around play, curiosity, and exploration.",
      "possible_update_to_prior_position": false,
      "confidence": "high"
    }
  ],
  "uncertainty_notes": [
    {
      "refs": [
        "video:predictive-history-tymnsa83nhy@transcript:v1#seg-0064"
      ],
      "note": "The transcript likely renders 'Doylet Club' incorrectly; public read should avoid relying on this title unless verified."
    }
  ]
}
