{
  "source_id": "video:predictive-history-hk-yhi3-prw",
  "source_date": "2025-10-11",
  "packet_id": "predictive-history-hk-yhi3-prw-semantics-pkt-0007",
  "interactions": [
    {
      "refs": [
        "video:predictive-history-hk-yhi3-prw@transcript:v1#seg-0049",
        "video:predictive-history-hk-yhi3-prw@transcript:v1#seg-0050"
      ],
      "kind": "monologue",
      "summary": "Jiang uses Hannah Arendt to define totalitarian regimes as cult-like bureaucracies removed from reality, driven by expansion, and committed to defying reality.",
      "speaker_attribution": "Jiang lecture.",
      "confidence": "high"
    },
    {
      "refs": [
        "video:predictive-history-hk-yhi3-prw@transcript:v1#seg-0051",
        "video:predictive-history-hk-yhi3-prw@transcript:v1#seg-0052",
        "video:predictive-history-hk-yhi3-prw@transcript:v1#seg-0053",
        "video:predictive-history-hk-yhi3-prw@transcript:v1#seg-0054",
        "video:predictive-history-hk-yhi3-prw@transcript:v1#seg-0055"
      ],
      "kind": "exchange",
      "summary": "Jiang asks a student to introduce who he is, rejects the personal answer, and says the state sees only a usable category: teenage boy, future factory labor, or future soldier.",
      "speaker_attribution": "Jiang classroom demonstration with student response.",
      "confidence": "high"
    },
    {
      "refs": [
        "video:predictive-history-hk-yhi3-prw@transcript:v1#seg-0056"
      ],
      "kind": "monologue",
      "summary": "Jiang defines high-modernist state ideology as arrogant planning that imposes paradise from above, rejects feedback, weakens civil society, and begins the James Scott forest example.",
      "speaker_attribution": "Jiang lecture.",
      "confidence": "high"
    }
  ],
  "speaker_notes": [
    {
      "refs": [
        "video:predictive-history-hk-yhi3-prw@transcript:v1#seg-0052"
      ],
      "note": "This is a student's live self-introduction used in Jiang's state-classification demonstration.",
      "suggested_speaker": "student",
      "confidence": "high"
    },
    {
      "refs": [
        "video:predictive-history-hk-yhi3-prw@transcript:v1#seg-0054"
      ],
      "note": "A brief non-Jiang reaction to Jiang saying the student's answer is wrong.",
      "suggested_speaker": "student/audience",
      "confidence": "medium"
    }
  ],
  "claims": [
    {
      "claim": "Jiang extends Arendt's description of totalitarianism to bureaucracy generally: all governments and bureaucracies tend toward totalitarianism because that is how they justify their existence.",
      "refs": [
        "video:predictive-history-hk-yhi3-prw@transcript:v1#seg-0049",
        "video:predictive-history-hk-yhi3-prw@transcript:v1#seg-0050"
      ],
      "temporal_scope": "Lecture model on 2025-10-11.",
      "topic_tags": [
        "arendt",
        "totalitarianism",
        "bureaucracy",
        "government"
      ],
      "claim_type": "model",
      "confidence": "high"
    },
    {
      "claim": "The state does not care about personal history, aspirations, or individuality; it classifies people into administratively useful categories it can exploit.",
      "refs": [
        "video:predictive-history-hk-yhi3-prw@transcript:v1#seg-0051",
        "video:predictive-history-hk-yhi3-prw@transcript:v1#seg-0052",
        "video:predictive-history-hk-yhi3-prw@transcript:v1#seg-0053",
        "video:predictive-history-hk-yhi3-prw@transcript:v1#seg-0055"
      ],
      "temporal_scope": "Lecture demonstration on 2025-10-11.",
      "topic_tags": [
        "state",
        "classification",
        "legibility",
        "exploitation"
      ],
      "claim_type": "model",
      "confidence": "high"
    },
    {
      "claim": "High-modernist bureaucracy becomes arrogant because it is a monopoly; it imposes planning, rejects criticism, weakens civil society, and therefore withers and fails.",
      "refs": [
        "video:predictive-history-hk-yhi3-prw@transcript:v1#seg-0055",
        "video:predictive-history-hk-yhi3-prw@transcript:v1#seg-0056"
      ],
      "temporal_scope": "Lecture model on 2025-10-11.",
      "topic_tags": [
        "high-modernism",
        "civil-society",
        "state-failure",
        "planning"
      ],
      "claim_type": "model",
      "confidence": "high"
    }
  ],
  "signature_moments": [
    {
      "refs": [
        "video:predictive-history-hk-yhi3-prw@transcript:v1#seg-0053",
        "video:predictive-history-hk-yhi3-prw@transcript:v1#seg-0055"
      ],
      "moment": "The student's life story is the wrong answer; to the state he is a teenage boy who can be used in a factory or sent to war.",
      "source_phrase": "you're a teenage boy",
      "why_it_matters": "It makes James Scott's legibility argument visceral through a live classroom reduction.",
      "tone": "reversal",
      "confidence": "high"
    },
    {
      "refs": [
        "video:predictive-history-hk-yhi3-prw@transcript:v1#seg-0056"
      ],
      "moment": "The planning bureaucracy believes it can achieve paradise, and that belief is exactly what makes it authoritarian.",
      "source_phrase": "through its own planning, it can achieve paradise",
      "why_it_matters": "It ties utopian planning to refusal of feedback and institutional death.",
      "tone": "causal-chain",
      "confidence": "high"
    }
  ],
  "glossary_terms": [
    {
      "term": "high modernist ideology",
      "refs": [
        "video:predictive-history-hk-yhi3-prw@transcript:v1#seg-0055",
        "video:predictive-history-hk-yhi3-prw@transcript:v1#seg-0056"
      ],
      "definition_or_usage": "The planning ideology of a monopolistic bureaucracy that believes it can impose paradise and therefore refuses criticism or local feedback.",
      "confidence": "high"
    },
    {
      "term": "Seeing Like a State",
      "refs": [
        "video:predictive-history-hk-yhi3-prw@transcript:v1#seg-0050",
        "video:predictive-history-hk-yhi3-prw@transcript:v1#seg-0051"
      ],
      "definition_or_usage": "James Scott book Jiang uses to explain state legibility, planning, and the destruction of spontaneity and local knowledge.",
      "confidence": "high"
    }
  ],
  "chronology_notes": [],
  "uncertainty_notes": [
    {
      "refs": [
        "video:predictive-history-hk-yhi3-prw@transcript:v1#seg-0051"
      ],
      "note": "The sentence describing Scott's four reasons is ASR-damaged; the clear usable material begins with the live classification demonstration."
    }
  ]
}
