{
  "packet_id": "predictive-history-gfqji0qevok-semantics-pkt-0006",
  "source_id": "video:predictive-history-gfqji0qevok",
  "source_date": "2025-01-07",
  "interactions": [
    {
      "refs": [
        "video:predictive-history-gfqji0qevok@transcript:v1#seg-0041",
        "video:predictive-history-gfqji0qevok@transcript:v1#seg-0042"
      ],
      "kind": "monologue",
      "summary": "Jiang closes by reversing Augustine point by point: love is God, humans are created out of God, love exists only between humans, and the human mission is to love and imagine so new worlds are created for God to celebrate.",
      "speaker_attribution": "Jiang concluding the lecture.",
      "confidence": "high"
    }
  ],
  "speaker_notes": [],
  "claims": [
    {
      "claim": "Jiang argues against Augustine that humans are created out of God rather than out of nothing, so God is in and with us.",
      "refs": [
        "video:predictive-history-gfqji0qevok@transcript:v1#seg-0041"
      ],
      "temporal_scope": "Concluding interpretation in the 2025-01-07 lecture.",
      "topic_tags": [
        "augustine",
        "creation",
        "god",
        "humanity"
      ],
      "claim_type": "model",
      "confidence": "high"
    },
    {
      "claim": "He defines love as existing only between humans because God is within humans; to love God means to love concrete people such as Beatrice, one's mother, or one's son.",
      "refs": [
        "video:predictive-history-gfqji0qevok@transcript:v1#seg-0041"
      ],
      "temporal_scope": "Definition in this lecture.",
      "topic_tags": [
        "love",
        "god",
        "human-relations",
        "beatrice"
      ],
      "claim_type": "definition",
      "confidence": "high"
    },
    {
      "claim": "Jiang concludes that there is no final end to the universe and no point at which humans know everything.",
      "refs": [
        "video:predictive-history-gfqji0qevok@transcript:v1#seg-0042"
      ],
      "temporal_scope": "Concluding cosmological claim in this lecture.",
      "topic_tags": [
        "universe",
        "knowledge",
        "infinity"
      ],
      "claim_type": "model",
      "confidence": "high"
    },
    {
      "claim": "He says humans continue God's legacy by imagining and loving; imagination is an act of creation that makes new worlds for God to celebrate.",
      "refs": [
        "video:predictive-history-gfqji0qevok@transcript:v1#seg-0042"
      ],
      "temporal_scope": "Final normative claim in this lecture.",
      "topic_tags": [
        "imagination",
        "love",
        "creation",
        "mission"
      ],
      "claim_type": "normative",
      "confidence": "high"
    }
  ],
  "signature_moments": [
    {
      "refs": [
        "video:predictive-history-gfqji0qevok@transcript:v1#seg-0041"
      ],
      "moment": "You cannot love God as an idea; you have to love another human.",
      "source_phrase": "if you love God you don't love God because God is an idea you have to love each other",
      "why_it_matters": "It turns theology into concrete human relation and completes the anti-Augustinian reversal.",
      "tone": "reversal",
      "confidence": "high"
    },
    {
      "refs": [
        "video:predictive-history-gfqji0qevok@transcript:v1#seg-0042"
      ],
      "moment": "Love and imagination continue God's legacy by creating new worlds.",
      "source_phrase": "to love and to imagine because then we create new worlds for God to celebrate",
      "why_it_matters": "It is the lecture's final answer to why imagination matters cosmologically.",
      "tone": "causal-chain",
      "confidence": "high"
    }
  ],
  "glossary_terms": [
    {
      "term": "love only between humans",
      "refs": [
        "video:predictive-history-gfqji0qevok@transcript:v1#seg-0041"
      ],
      "definition_or_usage": "Jiang's conclusion that love is not attachment to objects or an abstract idea of God, but relation to people because God is within humans.",
      "confidence": "high"
    },
    {
      "term": "God's legacy",
      "refs": [
        "video:predictive-history-gfqji0qevok@transcript:v1#seg-0042"
      ],
      "definition_or_usage": "Human participation in creation through imagination and love.",
      "confidence": "high"
    }
  ],
  "chronology_notes": [
    {
      "refs": [
        "video:predictive-history-gfqji0qevok@transcript:v1#seg-0042"
      ],
      "note": "Jiang explicitly says this is the first Dante lecture and that the next Dante lecture follows on the next Tuesday.",
      "possible_update_to_prior_position": false,
      "confidence": "high"
    }
  ],
  "uncertainty_notes": []
}
