{
  "packet_id": "interview-izzvijq0gka-semantics-pkt-0032",
  "source_id": "video:interview-izzvijq0gka",
  "source_date": "2026-05-18",
  "interactions": [
    {
      "refs": [
        "video:interview-izzvijq0gka@transcript:v1#seg-0249",
        "video:interview-izzvijq0gka@transcript:v1#seg-0253"
      ],
      "kind": "exchange",
      "summary": "Sneako says freedom begins when death no longer controls you, Jiang expands that fearlessness to social ridicule and institutional authority by urging people to trust intuition rather than 'the science,' and the two then pivot into a shared condemnation of Fauci and his pardon.",
      "speaker_attribution": "Sneako and Jiang exchange",
      "confidence": "high"
    },
    {
      "refs": [
        "video:interview-izzvijq0gka@transcript:v1#seg-0254",
        "video:interview-izzvijq0gka@transcript:v1#seg-0256"
      ],
      "kind": "question",
      "summary": "Sneako asks about Jiang's greatest hardship and how he overcame it, and Jiang begins a deeply biographical answer about racist bullying in Canada, domestic violence, refuge in the library, and suicidal thoughts between roughly ages fourteen and seventeen.",
      "speaker_attribution": "Sneako question and Jiang answer",
      "confidence": "high"
    }
  ],
  "speaker_notes": [
    {
      "refs": [
        "video:interview-izzvijq0gka@transcript:v1#seg-0251"
      ],
      "note": "Segment 0251 is an empty ASR fragment and carries no semantic content. It should not be mistaken for a missing speaker turn.",
      "suggested_speaker": null,
      "confidence": "high"
    },
    {
      "refs": [
        "video:interview-izzvijq0gka@transcript:v1#seg-0250",
        "video:interview-izzvijq0gka@transcript:v1#seg-0253"
      ],
      "note": "The Fauci material is framed as Jiang and Sneako's polemical interpretation of COVID-era authority and a reported pardon, not as independently established legal fact within the source.",
      "suggested_speaker": "Jiang and Sneako",
      "confidence": "high"
    }
  ],
  "claims": [
    {
      "claim": "Jiang argues that a good life requires risk, exploration, and fearlessness not only toward death but also toward ridicule and social ostracism.",
      "refs": [
        "video:interview-izzvijq0gka@transcript:v1#seg-0250"
      ],
      "temporal_scope": "Normative life advice stated on 2026-05-18.",
      "topic_tags": [
        "fearlessness",
        "death",
        "risk",
        "ostracism",
        "best life"
      ],
      "claim_type": "normative",
      "confidence": "high"
    },
    {
      "claim": "He says intuition is a person's greatest weapon and that demands to abandon one's gut in favor of authoritative science are attempts at control akin to cult leadership.",
      "refs": [
        "video:interview-izzvijq0gka@transcript:v1#seg-0250"
      ],
      "temporal_scope": "Psychological and political claim stated on 2026-05-18.",
      "topic_tags": [
        "intuition",
        "control",
        "science",
        "cult leaders",
        "authority"
      ],
      "claim_type": "diagnosis",
      "confidence": "high"
    },
    {
      "claim": "Jiang says people who trusted Fauci during COVID were likely harmed by that trust and treats the episode as evidence that official experts can be manipulative and unworthy of obedience.",
      "refs": [
        "video:interview-izzvijq0gka@transcript:v1#seg-0250"
      ],
      "temporal_scope": "Retrospective political judgment stated on 2026-05-18 about the COVID period.",
      "topic_tags": [
        "Fauci",
        "COVID",
        "trust",
        "expert authority",
        "control"
      ],
      "claim_type": "diagnosis",
      "confidence": "medium"
    },
    {
      "claim": "Jiang says his hardest adolescent period was high school in Canada, where he faced daily racist bullying, academic collapse, abuse at home, and repeated suicidal thoughts.",
      "refs": [
        "video:interview-izzvijq0gka@transcript:v1#seg-0255",
        "video:interview-izzvijq0gka@transcript:v1#seg-0256"
      ],
      "temporal_scope": "Biographical account stated on 2026-05-18 about ages roughly 14 to 17.",
      "topic_tags": [
        "Canada",
        "bullying",
        "racism",
        "suicidal thoughts",
        "adolescence"
      ],
      "claim_type": "evidence",
      "confidence": "high"
    },
    {
      "claim": "He says books and the library were his only refuge during that period, transporting him into another universe and anchoring his later love of reading.",
      "refs": [
        "video:interview-izzvijq0gka@transcript:v1#seg-0256"
      ],
      "temporal_scope": "Biographical and literary-origin claim stated on 2026-05-18 about adolescence.",
      "topic_tags": [
        "library",
        "books",
        "refuge",
        "reading",
        "origin story"
      ],
      "claim_type": "evidence",
      "confidence": "high"
    }
  ],
  "signature_moments": [
    {
      "refs": [
        "video:interview-izzvijq0gka@transcript:v1#seg-0250"
      ],
      "moment": "The battle for freedom is shifted inward: the real prison is fear of death, ridicule, and expert authority, and the first act of resistance is to trust your own gut.",
      "source_phrase": "trust your gut",
      "why_it_matters": "It compresses Jiang's libertarian-spiritual ethic into a portable rule about intuition versus control.",
      "tone": "provocation",
      "confidence": "high"
    },
    {
      "refs": [
        "video:interview-izzvijq0gka@transcript:v1#seg-0256"
      ],
      "moment": "The library becomes a parallel universe where the bullied child can breathe, make friends through books, and survive a life that otherwise feels hopeless.",
      "source_phrase": "reading books transported me to like different a different universe",
      "why_it_matters": "It is the packet's strongest image and an important origin story for Jiang's later life of reading and teaching.",
      "tone": "image",
      "confidence": "high"
    }
  ],
  "glossary_terms": [
    {
      "term": "trust your gut",
      "refs": [
        "video:interview-izzvijq0gka@transcript:v1#seg-0250"
      ],
      "definition_or_usage": "Jiang's maxim that intuition is the strongest defense against manipulative institutions and social control.",
      "confidence": "high"
    }
  ],
  "chronology_notes": [
    {
      "refs": [
        "video:interview-izzvijq0gka@transcript:v1#seg-0249",
        "video:interview-izzvijq0gka@transcript:v1#seg-0256"
      ],
      "note": "The packet first turns mortality and trust into a critique of external authority, then pivots into Jiang's biographical testimony about how adolescent suffering, racism, and books formed him.",
      "possible_update_to_prior_position": false,
      "confidence": "high"
    }
  ],
  "uncertainty_notes": [
    {
      "refs": [
        "video:interview-izzvijq0gka@transcript:v1#seg-0250",
        "video:interview-izzvijq0gka@transcript:v1#seg-0253"
      ],
      "note": "The packet blends durable biographical material with highly polemical current-affairs commentary about Fauci and a pardon. Downstream work should not give those latter assertions more certainty than the source itself provides."
    }
  ]
}
